Respondents,Response.Date,Responses,Age
293,May 27 2020 06:47 PM,u think it is heavily stigmatized,21
294,May 27 2020 06:47 PM,That they are lazy,60
295,May 27 2020 06:47 PM,"Eat wrong foods, illness, depression,medicines,unmotivated or unable to get assistance or help",38
296,May 27 2020 06:45 PM,look down on them,59
297,May 27 2020 06:45 PM,I don’t know,62
298,May 27 2020 06:43 PM,Obesity is becoming more widely accepted in America due to the increasing prevalence of overweight people.,66
299,May 27 2020 06:43 PM,I don't know,25
300,May 27 2020 06:42 PM,any health problems they have is because they are overweight,35
301,May 27 2020 06:42 PM,Lazy - no self control.,64
302,May 27 2020 06:40 PM,They need to lose weight for their own good. We can't hold their hand,55
303,May 27 2020 06:40 PM,American public is very cruel and mean when it comes to overweight people,34
304,May 27 2020 06:38 PM,They don’t.,32
305,May 27 2020 06:36 PM,people view obese persons as ‘less than’ and/or ‘having no self-control’ and/or not intelligent,73
306,May 27 2020 06:35 PM,bad,56
307,May 27 2020 06:35 PM,Disgusting,69
308,May 27 2020 06:34 PM,"More tolerant than in the past, but still biased because of the before and after photos on ads. ",69
309,May 27 2020 06:32 PM,that it is the person's fault,67
310,May 27 2020 06:32 PM,That it is only about self control and not genetics. It seems like it is about both environment and behavior and genetics.,72
311,May 27 2020 06:31 PM,that most obese people are that way by choice.,20
312,May 27 2020 06:31 PM,They body shame,41
313,May 27 2020 06:30 PM,not sure ,36
314,May 27 2020 06:30 PM,I have no comment people should be accepted the way they are,53
315,May 27 2020 06:29 PM,unsure,65
316,May 27 2020 06:27 PM,"That you’re fat and don’t care or that because you don’t look a skinny as they think every single person should be,that even if you’re at a healthy weight for your age and height they think you still need to lose weight to fit their expectations.",32
317,May 27 2020 06:25 PM,They think that over weight women are brave while overweight men are bad and should lose weight. It is very unfair and in most cases weight is something controllable,24
318,May 27 2020 06:24 PM,Very biased against them,25
319,May 27 2020 06:23 PM,they are against fat and the super skinny people,43
320,May 27 2020 06:20 PM,not sure,50
321,May 27 2020 06:20 PM,That with proper diet and exercise a desirable weight can be attained and maintained,63
322,May 27 2020 06:19 PM,Wasting their life and not trying to control their weight,22
323,May 27 2020 06:19 PM,"The advertising is to eat, enjoy, you deserve this food or drink etc.   The restaurants that advertise on television are serving unhealthy food choices full of unhealthy fats,high sodium, chemical, processed, high sugar...yet the pressure from media is to be thin and perky and perfect and under 30.  ",51
324,May 27 2020 06:19 PM,Actually a lot less than when I was a young adult!,69
325,May 27 2020 06:17 PM,"Lazy, unmotivated, no will power, undisciplined, gross",29
326,May 27 2020 06:16 PM,that they need to get help because obesity can cause health problems.,43
327,May 27 2020 06:16 PM,They frown upon it,46
328,May 27 2020 06:15 PM,"I feel they’re lazy, they feel they don’t have pride in themselves, they feel they don’t take care of themselves, they feel they’re not as attractive as other people. And sometimes getting in the way and keeping it on can be a barrier to not letting that stuff creep in.",58
329,May 27 2020 06:14 PM,that people who are overweight are entirely responsible through their life choices,51
330,May 27 2020 06:14 PM,40% of the American public is obese.  The remainder thinks that that obesity is unhealthy. ,34
331,May 27 2020 06:13 PM,Lazy people.,33
332,May 27 2020 06:13 PM,Lazy and or a glutten,44
333,May 27 2020 06:12 PM,That they are lazy,31
334,May 27 2020 06:09 PM,That they eat too much and it’s their own fault for being obese.,36
335,May 27 2020 06:07 PM,We are obsessed with LOOKS! I think people can be cruel and make fun of a person who has a weight problem.,37
336,May 27 2020 06:07 PM,They think people with obesity are lazy and weak-willed.,57
337,May 27 2020 06:07 PM,"It’s acceptable. Many people across the country are obese, and don’t do anything about it.",37
338,May 27 2020 06:05 PM,They put down people who are extremely overweight/obese.,42
339,May 27 2020 06:05 PM,It’s a public health crisis.,73
340,May 27 2020 06:04 PM,They judge them.,70
341,May 27 2020 06:03 PM,That they are overweight and it’s not good,68
342,May 27 2020 06:02 PM,That they are lazy,49
343,May 27 2020 06:00 PM,"Well, taking into account 30% of the country is morbidly obese and another 30% overweight many people hate themselves and at the same time feel pity.  Mostly though I think they are appalled. ",60
344,May 27 2020 06:00 PM,Congratulations,21
345,May 27 2020 05:59 PM,"They think they can’t control their eating, but it is not always caused by that.",38
346,May 27 2020 05:58 PM,X,75
347,May 27 2020 05:58 PM,It’s unhealthy but being’ thick’ is a trend so many think it’s okay,44
348,May 27 2020 05:56 PM,very negatively. lack of control,62
349,May 27 2020 05:55 PM,Not supportive,59
350,May 27 2020 05:53 PM,They are looked at as being week and lazy. No one cares if medications affect body weight or other medical/social issues,26
351,May 27 2020 05:52 PM,They actually provide a ton of support and encore to people with obesity compared to people who are underweight.,60
352,May 27 2020 05:52 PM,Not the correct things,34
353,May 27 2020 05:51 PM,"people eat the wrong food
and don't exercise",48
354,May 27 2020 05:49 PM,disgusted,26
355,May 27 2020 05:49 PM,They think they better than them,66
356,May 27 2020 05:46 PM,"obesity is a problem in the context of health and economic impact on our healthcare system. it is classified as a disease and I think the public makes individual judgements (bias), often stereotyping, with limited knowledge.",32
357,May 27 2020 05:46 PM,not good things,18
358,May 27 2020 05:46 PM,They look down upon people who are obese,34
359,May 27 2020 05:46 PM,That they don't want to be thinner  bad enough. ,61
360,May 27 2020 05:46 PM,Looks down at them,21
361,May 27 2020 05:44 PM,Not much because there are so many with the problem. ,50
362,May 27 2020 05:42 PM,"They feel people are just lazy.  When some people, like me, had surgeries that led to weight gain and made it hard to lose it.",42
363,May 27 2020 05:42 PM,As more of the American public becomes obese there is naturally a greater understanding or acceptance of it.On the other hand obese people are generally discriminated against.,31
364,May 27 2020 05:41 PM,That it is all their fault and no self discipline,20
365,May 27 2020 05:41 PM,"Lazy, slovenly, underachiever, less educated and/or intuitive",26
366,May 27 2020 05:41 PM,I think there is a general feeling of hopelessness towards the issue. I see a lot of people being treated negatively due to their weight. But obesity is also fairly prevalent in the US and I do not see many people talking about how to solve it.,51
367,May 27 2020 05:40 PM,"society thinks overweight people are lazy, gross, sad, ugly",32
368,May 27 2020 05:40 PM,That they are lazy,69
369,May 27 2020 05:40 PM,N/a,42
370,May 27 2020 05:37 PM,no,48
371,May 27 2020 05:36 PM,"They are portrayed as nasty, stupid, and evil. Most villains in movies are on the larger side, which helps drive the stereotype.",57
372,May 27 2020 05:36 PM,"Not healthy, doesn't exercise, poor eating habits, probably has other health problems too, not someone I want to be seen with",53
373,May 27 2020 05:35 PM,That they are lazy,70
374,May 27 2020 05:35 PM,That it’s disappointing and disgusting,42
375,May 27 2020 05:35 PM,That its only because of food,58
376,May 27 2020 05:34 PM,"From what I've experienced, the public seems to think that obese people are lazy, unintelligent, and don't care about themselves.",60
377,May 27 2020 05:33 PM,"Sick, sometimes positive/embracing but mostly bad",25
378,May 27 2020 05:32 PM,people don’t like or get mad at obesity,33
379,May 27 2020 05:32 PM,not sure,40
380,May 27 2020 05:32 PM,negative,58
381,May 27 2020 05:31 PM,They hate it,28
382,May 27 2020 05:31 PM,"They are unhealthy, ugly and not like the usual type",69
383,May 27 2020 05:31 PM,No one likes them,26
384,May 27 2020 05:31 PM,I don’t know,49
385,May 27 2020 05:31 PM,Good morning good luck to your new game will be,75
386,May 27 2020 05:30 PM,We're a fat people. People fatter than us disguist us.,20
387,May 27 2020 05:30 PM,They are not liked. Fat shamed if you will,64
388,May 27 2020 05:29 PM,They hate obese people and think they’re lazy.,67
389,May 27 2020 05:28 PM,Unforgiving and rude,62
390,May 27 2020 05:27 PM,Obese people are a drag upon society and cost everyone much larger health and life insurance premiums due to their drag and unhealthy condition in society.,54
391,May 27 2020 05:26 PM,That it’s a choice and that people choose to be obese and that there is no underlying reason that they are that way,65
392,May 27 2020 05:26 PM,Not sure.,20
393,May 27 2020 05:26 PM,"I think the American public thinks obesity is somewhat normal now.  Although we still see models on social media being skinny or perfectly curvy, I have noticed more advertisements with plus size models.",42
394,May 27 2020 05:25 PM,They are fat and lazy and dont do anything but eat ,60
395,May 27 2020 05:24 PM,that they should take better care of their health  &  stop with the fast food.,34
396,May 27 2020 05:24 PM,Depends on how much you are over weight.,61
397,May 27 2020 05:22 PM,I think everyone just assumes that when someone is obese they are lazy and disgusting and all they do is eat junk food and watch tv,68
398,May 27 2020 05:21 PM,"I think there are some people that don’t see it as an issue. I think there are some that see it as a larger health issue (effecting more than just those who are obese), and I think there are some who look down on it simply because it’s not the “ideal.”",55
399,May 27 2020 05:21 PM,I don't know,19
400,May 27 2020 05:20 PM,none,24
401,May 27 2020 05:20 PM,in general it is considered a very bad condition.,53
402,May 27 2020 05:17 PM,they are lazy,64
403,May 27 2020 05:17 PM,normal,28
404,May 27 2020 05:17 PM,They think that it means that you’re in capable of doing any and everything. And it seems like they love to body shame bigger people and believe that they are unhealthy when in reality most of us are not.,24
405,May 27 2020 05:17 PM,They think overweight people are lazy and unattractive,30
406,May 27 2020 05:17 PM,Not sure,41
407,May 27 2020 05:16 PM,They make bad choices with their diet and activity level,65
408,May 27 2020 05:16 PM,They are humans,28
409,May 27 2020 05:13 PM,"I think people are disgusted and act as though people should not be as big as they are, when they don’t look in the mirror and see that they, too, are overweight. There can be medical reasons for weight problems. My experience was after a major surgery and no matter how hard I tried or what I did, I could not lose the weight. Again, I gained it all over, so it was difficult to tell how heavy I had gotten (40+ pounds over where I was before surgery).",48
410,May 27 2020 05:11 PM,lazy,55
411,May 27 2020 05:11 PM,There are two extremes. People who think it is a disease or people who think you should embrace it,27
412,May 27 2020 05:11 PM,I think the American public is very concerned about weight loss,32
413,May 27 2020 05:09 PM,They have become too accepting.,57
414,May 27 2020 05:09 PM,Since most of America is this overweight it’s probably no big deal.,21
415,May 27 2020 05:08 PM,quite a few make comments about people's weight and they don't realize their own size,34
416,May 27 2020 05:08 PM,They are looked down on,32
417,May 27 2020 05:06 PM,That they a glutinous.,61
418,May 27 2020 05:04 PM,most americans are fat so they don’t care,67
419,May 27 2020 05:04 PM,B.,27
420,May 27 2020 05:03 PM,"That a person lacks self control
Or is lazy",53
421,May 27 2020 05:02 PM,They think they are weak and out of control,25
422,May 27 2020 05:02 PM,They are equal to skinny people,72
423,May 27 2020 05:02 PM,That it is all under their control.,72
424,May 27 2020 05:01 PM,They think they are unhealthy and choose to be like that and think it’s very unattractive,72
425,May 27 2020 05:01 PM,Need help,23
426,May 27 2020 05:00 PM,Different things. Some people think they are lazy or stupid. They think they have no control. Some think they are dirty,27
427,May 27 2020 04:59 PM,"obesity is based on poor food and lifestyle choices, so the solution is quick and easy.",55
428,May 27 2020 04:59 PM,it's a disease and mentally damaging.,69
429,May 27 2020 04:57 PM,"Most ""fit"" people have a huge bias against it - I suppose they believe that if they can easily control it, it must be that way for everyone, and obese people are lazy/weak/bad.  Personally I think it's irrelevant and have a huge problem with the country's fixation on weight permeating everything.  Billions of dollars are made on convincing everyone that they need to ""lose weight.""  ",67
430,May 27 2020 04:56 PM,negative overall,46
431,May 27 2020 04:56 PM,We judge very quickly if someone’s too big or too thin,55
432,May 27 2020 04:56 PM,They are held to lower standards and they choose to be this way.,43
433,May 27 2020 04:56 PM,Negatively,20
434,May 27 2020 04:55 PM,"They assume the overweight are
Lazy
Slovenly
Low class
Unmotivated
Unloveable
Bad parents—when they have children
Greedy",49
435,May 27 2020 04:54 PM,It’s bad to be fat,33
436,May 27 2020 04:54 PM,If you do not look like a tv or movie personality they think you are over weight...,28
437,May 27 2020 04:53 PM,not sure,37
438,May 27 2020 04:53 PM,They are lazy and stupid,23
439,May 27 2020 04:53 PM,"There lazy, unkept, disgusting ",18
440,May 27 2020 04:53 PM,"Some harbor weight bias but many are themselves, overweight so they may sympathize with obese people. Over all I think the public has a negative view of obese people.",58
441,May 27 2020 04:51 PM,The public thinks thinks that you should control your weight - it is unhealthy to be overweight (proven by the covid virus),56
442,May 27 2020 04:51 PM,It is a epidemic,34
443,May 27 2020 04:50 PM,thinks unfairly towards them,25
444,May 27 2020 04:50 PM,We are lazy and ugly.,59
445,May 27 2020 04:50 PM,N/A,38
446,May 27 2020 04:50 PM,Idk,38
447,May 27 2020 04:50 PM,I feel most find obesity yo be disgusting.,57
448,May 27 2020 04:50 PM,Hey hey hey,74
449,May 27 2020 04:47 PM,Why did they let that happen?,22
450,May 27 2020 04:47 PM,"That they don’t care about their health, that they have terrible self control, they are eating their feelings due to trauma or have a mental disorder that causes them to over eat",58
451,May 27 2020 04:46 PM,"Lazy, overeater, slob, out of control",73
452,May 27 2020 04:46 PM,It’s their fault,35
453,May 27 2020 04:46 PM,"It seems split. Some people think that they’re just at their natural body size and that little can be done to change their weight. Others think that they’re unhealthy and lazy, and just need to eat less.",47
454,May 27 2020 04:46 PM,I don’t know,64
455,May 27 2020 04:45 PM,They shame heavy people,44
456,May 27 2020 04:45 PM,They are somewhat looked down upon butnat the same time the obesity rate is so high it's hard to judge too harshly because everyone else is fat too,33
457,May 27 2020 04:45 PM,That it should be easy for us to lose weight,71
458,May 27 2020 04:45 PM,Good,37
459,May 27 2020 04:43 PM,People with obesity are slobs who don't care about their weight and have little or no self control.,41
460,May 27 2020 04:43 PM,People who are overweight are disgusting and have no self control.,19
461,May 27 2020 04:42 PM,People think less of people who are obese,40
462,May 27 2020 04:41 PM,that it's the fault of the individual and not a public health concern at large.,29
463,May 27 2020 04:41 PM,"They’re seen as lazy and their weight is blamed on them. While they can fix it, it can be the result of their situation or predicament.",45
464,May 27 2020 04:41 PM,They make fun of people that are obese,36
465,May 27 2020 04:40 PM,they judge them by looks and not personality,25
466,May 27 2020 04:40 PM,That they are slovenly and lack discipline.,39
467,May 27 2020 04:40 PM,It’s become so common these days that I’m not sure people too much about it.,20
468,May 27 2020 04:40 PM,Bad,31
469,May 27 2020 04:39 PM,they think they are lazy and dont try to do anything to help improve their situation.,58
470,May 27 2020 04:38 PM,They are lazy,69
471,May 27 2020 04:38 PM,There’s more stigma then necessary but people still need to be aware that obesity is a disease and a health risk. People shouldn’t be shamed for it but encouraged to try to be healthier and given help with weight loss or diagnosing underlying medical conditions,75
472,May 27 2020 04:37 PM,They are not working hard enough to keep their weight in check.,60
473,May 27 2020 04:36 PM,"fat is not attractive, in my opinion it really isnt",36
474,May 27 2020 04:36 PM,They think overweight people have no will power and like being heavy. ,69
475,May 27 2020 04:36 PM,That Americans are all fat,36
476,May 27 2020 04:35 PM,it is a personal dilemma. it is  not up to me to judge another individual,27
477,May 27 2020 04:35 PM,That it’s gross and controllable,59
478,May 27 2020 04:35 PM,Lack of self control,33
479,May 27 2020 04:35 PM,Generally thin or ideal BMI persons believe that most or all overweight people are 100% at fault for their size without considering factors like diabetes heart conditions or immobility due to bone problems,37
480,May 27 2020 04:34 PM,That they are lazy,68
481,May 27 2020 04:34 PM,It is acceptable,72
482,May 27 2020 04:33 PM,That there need to be better solutions,39
483,May 27 2020 04:33 PM,Khdutsjg ysiycmgsjtxn hysuyck,28
484,May 27 2020 04:32 PM,negatively,70
485,May 27 2020 04:32 PM,Think some people take it seriously. Everything is processed or has tons of sugar. Eating healthy is more expensive which is wrong!,63
486,May 27 2020 04:32 PM,Rudeness making fun of people,49
487,May 27 2020 04:32 PM,"Negatively - thinness has always been valued more, and along with our love affair with individualism and personal freedom, we also tend to believe that obesity is a personal responsibility problem rather than a systemic issue (regarding food scarcity, poverty, etc.)",34
488,May 27 2020 04:32 PM,Is a diseases,59
489,May 27 2020 04:32 PM,Idk,51
490,May 27 2020 04:31 PM,they are lazy and unhealthy,56
491,May 27 2020 04:31 PM,Lazy,42
492,May 27 2020 04:30 PM,Fat,75
493,May 27 2020 04:29 PM,"That obese people are lazy, lack discipline/self control, have lower self image. That obese people are costing tax payers money for their health issues.  That the majority are lower income and education ",45
494,May 27 2020 04:29 PM,Society marginalizes overweight people.,61
495,May 27 2020 04:28 PM,"fat, lazy",67
496,May 27 2020 04:28 PM,The American public thinks obese people are lazy and that they eat too much. The American public thinks obese people make poor food choices and don't try to lose weight.,63
497,May 27 2020 04:27 PM,I don’t know,58
498,May 27 2020 04:26 PM,it thinks that those with obesity are lazy,39
499,May 27 2020 04:26 PM,Nothing special,47
500,May 27 2020 04:24 PM,everyone is complaining but everyone is acting unconsciously or not.,23
501,May 27 2020 04:24 PM,"Even though most Americans are overweight, I believe that they have at least a small disgust reaction to those who are obese OR too thin. Often overweight people are written off as lazy or less intelligent, and thin people  are considered ill. ",67
502,May 27 2020 04:21 PM,Discrimination,30
503,May 27 2020 04:20 PM,"in general, people who are obese are not thought of as positively as those who are not. it is another American stigma in which people who do not fit a certain pattern are thought of as being ""less than"".",70
504,May 27 2020 04:18 PM,They are unhealthy,67
505,May 27 2020 04:17 PM,"not sure, it's not a concern to me",53
506,May 27 2020 04:17 PM,That they are lazy. Some profess the belief that obesity is a result of sexual trauma.,56
507,May 27 2020 04:17 PM,I think the American public has a negative opinion of people with obesity,24
508,May 27 2020 04:17 PM,I don’t think the American public cares as much as they used to about health,55
509,May 27 2020 04:16 PM,that it is gross.,30
510,May 27 2020 04:16 PM,Unhealthy,22
511,May 27 2020 04:16 PM,"Poor survey, you asked how many pounds I would like to LOSE, whereas the opposite is true for me.  Not everyone has an overweight problem.  My wife does, I don't.
Since the vast majority of people are overweight, the shaming must be done by a small minority.",45
512,May 27 2020 04:16 PM,No,54
513,May 27 2020 04:16 PM,"Despite having one of the highest percentage of citizens being obese, it's critical of those who are both over and underweight.",70
514,May 27 2020 04:14 PM,I think obesity is associated with laziness and lack of self control.,53
515,May 27 2020 04:13 PM,Or hung,65
516,May 27 2020 04:12 PM,"That overweight people are repellent, less intelligent, careless, inactive",28
517,May 27 2020 04:11 PM,they make jokes about. I wish we had more Fluffiest in the world,51
518,May 27 2020 04:11 PM,people think that they are outta control,58
519,May 27 2020 04:11 PM,Not sure,48
520,May 27 2020 04:09 PM,They think they're weak and unworthy of love or respect,57
521,May 27 2020 04:08 PM,they look down,62
522,May 27 2020 04:06 PM,that they need to lose weight,46
523,May 27 2020 04:05 PM,"Unhealthy, lazy",74
524,May 27 2020 04:05 PM,They think overweight people have no control over how much they eat,44
525,May 27 2020 04:05 PM,They think obese people are lazy or useless,70
526,May 27 2020 04:03 PM,they are used to it,48
527,May 27 2020 04:03 PM,Needs health care,35
528,May 27 2020 04:02 PM,I feel the bias doesn't really exist much until extreme obesity.,28
529,May 27 2020 04:01 PM,I think many younger people praise obesity in light of body positivity. I think many older people see that it’s unhealthy and leads to a shorter lifespan.,48
530,May 27 2020 04:01 PM,Hjrjnrnfjt,47
531,May 27 2020 04:01 PM,Fat and discriminated,33
532,May 27 2020 04:00 PM,Not much,45
533,May 27 2020 03:59 PM,"Weight bias is defined as negative attitudes towards, and beliefs about, others because of their weight. These negative attitudes are manifested by stereotypes and/or prejudice towards people with overweight and obesity",22
534,May 27 2020 03:59 PM,That they are lazy and that they don’t care,73
535,May 27 2020 03:58 PM,They see them as lazy,26
536,May 27 2020 03:57 PM,i feel normal,42
537,May 27 2020 03:57 PM,They think they are lesser people for being overweight,45
538,May 27 2020 03:57 PM,I feel normal,64
539,May 27 2020 03:57 PM,I feel normal,37
540,May 27 2020 03:55 PM,They are sitting home eating and watching TV and not trying to exercise.,53
541,May 27 2020 03:54 PM,"Fat, lazy slobs.",34
542,May 27 2020 03:53 PM,no,64
543,May 27 2020 03:52 PM,Americans are too quick to judge obese people. I think that most feel that obese people can control their weight. ,29
544,May 27 2020 03:52 PM,American public thinks fat people are disgusting,32
545,May 27 2020 03:51 PM,Most of them take it very serious because most of the people over here are overweight or too much body fat on them.,65
546,May 27 2020 03:50 PM,fat,35
547,May 27 2020 03:48 PM,"Obesity is definitely looked down on by both personal or business people.  It just makes it harder to succeed.
",63
548,May 27 2020 03:48 PM,It is a controllable condition.,25
549,May 27 2020 03:48 PM,Idk,65
550,May 27 2020 03:48 PM,Don’t want to see them or be around them.,54
551,May 27 2020 03:47 PM,????,45
552,May 27 2020 03:47 PM,they are ugly,32
553,May 27 2020 03:47 PM,starting to become alarmingly normal and part of body inclusivity despite health risks,66
554,May 27 2020 03:47 PM,hdmi,19
555,May 27 2020 03:47 PM,"If the person is very obese, I think people blame that person and find it disgusting.  But with so many overweight people now, it's almost the norm.  So people don't LIKE it but it's everywhere and it isn't as unusual now.  ",75
556,May 27 2020 03:46 PM,that they are lazy,26
557,May 27 2020 03:46 PM,Most people I know consider obesity to be awful and inherently mean a person is unhealthy,53
558,May 27 2020 03:46 PM,I think people want to accept the body positivity movement but at the end of the day people still want to lose weight for appearance related reasons / health reasons.,61
559,May 27 2020 03:45 PM,They don’t like fat people. They think they’re lazy and sloppy.,65
560,May 27 2020 03:44 PM,yes,60
561,May 27 2020 03:44 PM,h,33
562,May 27 2020 03:44 PM,That they are lazy and unable to control themselves.,64
563,May 27 2020 03:41 PM,normal,60
564,May 27 2020 03:40 PM,A mix of blame on individuals and blame on food and beverage companies,57
565,May 27 2020 03:39 PM,"the thought is that people who are over weight are some how bad, not good enough,",32
566,May 27 2020 03:39 PM,every now and then,43
567,May 27 2020 03:38 PM,It is unhealthy to be obese,36
568,May 27 2020 03:36 PM,think down upon them unfortunately.,43
569,May 27 2020 03:35 PM,That they are lazy.,26
570,May 27 2020 03:35 PM,I don’t know ,46
571,May 27 2020 03:34 PM,They think they are lazy and gluttonous,72
572,May 27 2020 03:34 PM,"The American public thinks they are slow, not intelligent, not motivated, unattractive",70
573,May 27 2020 03:33 PM,Unhealthy and careless,67
574,May 27 2020 03:32 PM,not reliable,28
575,May 27 2020 03:32 PM,There's a social stigma against people with obesity ,70
576,May 27 2020 03:32 PM,That they are lazy and just eat too much,34
577,May 27 2020 03:30 PM,that it's common and natural for the most part which is crazy,43
