Respondents,Response.Date,Responses,Age
881,May 27 2020 12:16 PM,"I don't think there's one universal feeling about people with obesity. some think it's sad, some think it's gross, some don't think one way or another about it. my personal thoughts are that a most people  have the ability to control their weight. if they want to lose weight they have to adjust their eating habits and activity level, unless there is an underlying health issue that prevents that from working. but a majority of obese people have the ability to lose the weight if they put a lot of time and effort into it. but that's not easy and that's why they don't do it",61
882,May 27 2020 12:15 PM,"over eating
lack of exercise",63
883,May 27 2020 12:13 PM,bad news,62
884,May 27 2020 12:13 PM,Their just fat,31
885,May 27 2020 12:12 PM,"I think, as more people become overweight, there is less stigma about it than there used to be.",30
886,May 27 2020 12:10 PM,Every American has an opinion.,73
887,May 27 2020 12:09 PM,They dont,35
888,May 27 2020 12:09 PM,They are burdens to society they lack self control,68
889,May 27 2020 12:08 PM,See question 1,67
890,May 27 2020 12:06 PM,In general I think society has the perception that overweight people are lazy.,30
891,May 27 2020 12:06 PM,I think that most Americans think that people with obesity tend to get it from eating unhealthy foods and large portions,39
892,May 27 2020 12:05 PM,Ugly and lazy,37
893,May 27 2020 12:05 PM,"They think it's unhealthy, and very awful; but for the most part, they don't know what to do about it. They try.",20
894,May 27 2020 12:05 PM,"That they're fat, gross looking and need to quit eating so much and go out, get off their ass and get to work.",59
895,May 27 2020 12:05 PM,It’s unhealthy,35
896,May 27 2020 12:05 PM,"In genera, they think people with obesity are gross, slobs, and lazy",34
897,May 27 2020 12:05 PM,I think some are ok with it but others are digusted and mean about it,27
898,May 27 2020 12:03 PM,People have a notion that they are lazy and undisciplined,26
899,May 27 2020 12:02 PM,"Obese people don't deserve to be seen or have good, fulfilling lives.",42
900,May 27 2020 12:02 PM,It is a disease and people can control it,24
901,May 27 2020 11:59 AM,Negative,56
902,May 27 2020 11:58 AM,"tenous tolerance, micro aggressive",75
903,May 27 2020 11:56 AM,"unhealthy, overeaters",31
904,May 27 2020 11:55 AM,It’s terrible,32
905,May 27 2020 11:55 AM,I think they think people that are obese choose to be that way.,31
906,May 27 2020 11:54 AM,It’s a disease,38
907,May 27 2020 11:53 AM,ok,58
908,May 27 2020 11:53 AM,"Obese individuals are viewed as lazy, greedy, and a burden to society.",58
909,May 27 2020 11:53 AM,NBC do if di d dg by if d tv s tut thx,46
910,May 27 2020 11:52 AM,They hate it,32
911,May 27 2020 11:51 AM,They judge a person as lazy,23
912,May 27 2020 11:51 AM,Tend to think they have little self control,48
913,May 27 2020 11:50 AM,that they are trash and not worth it,34
914,May 27 2020 11:50 AM,"Majority of Americans are overweight and obese. Some people are probably judgemental about obesity and some are probably judgemental about people who lose extreme amounts of weight. Anymore though, I feel obesity has become an American common lifestyle....not that I feel that is healthy for Americans.",33
915,May 27 2020 11:49 AM,"In my opinion the American public think that obese people are lazy, disgusting, unhealthy, unsuccessful, unmotivated, etc.",63
916,May 27 2020 11:47 AM,discriminate,45
917,May 27 2020 11:47 AM,They don't like fat people. They fear becoming fat.  They hate themselves for being fat.,19
918,May 27 2020 11:47 AM,Shameful,51
919,May 27 2020 11:47 AM,I think those people need to make the decision and effort to try and loose weight. It is not good to be obese. A little fat is good but not to much to where it can cause problems.,60
920,May 27 2020 11:47 AM,Hello pick me uo now,75
921,May 27 2020 11:46 AM,"They think they are lazy, uninteresting, poor",34
922,May 27 2020 11:46 AM,I don’t know,57
923,May 27 2020 11:45 AM,They think because people are over weight that they are nasty and that it’s their on fault that they are over weight.,39
924,May 27 2020 11:43 AM,In general I think that they are looked down upon and people can jump to conclusions that they are lazy or that they are not concerned about their appearance when they truly are,71
925,May 27 2020 11:42 AM,People have an eating disorder,42
926,May 27 2020 11:41 AM,People are big because they’re lazy and don’t eat or exercise right,39
927,May 27 2020 11:40 AM,fine,24
928,May 27 2020 11:35 AM,there's a stigma attatched,34
929,May 27 2020 11:34 AM,They are making clothes bigger so must be acceptable,30
930,May 27 2020 11:34 AM,"Mostly they think, ""lazy,"" but to a lesser extent, they may think, unclean, uncaring. I tend to think unmotivated, depressed, unhealthy. ",19
931,May 27 2020 11:33 AM,Most of Americans accepts obesity because of the simple fact that most of America is obese. The rest of us think it’s unhealthy and contributes to the reason why our country is going to shit. ,64
932,May 27 2020 11:31 AM,"they think they are less than. lazy, sloppy, can't control themselves. all not true.",33
933,May 27 2020 11:31 AM,"they think it's an epidemic but not one they want to solve by reevaluating their own life choices, or by stopping stigmatization of those with obesity and choosing to help instead",54
934,May 27 2020 11:31 AM,not sure,43
935,May 27 2020 11:31 AM,not all of them see others with a bias opinion,66
936,May 27 2020 11:31 AM,Think of them as gross,67
937,May 27 2020 11:31 AM,They try to help. There’s a show called 600 pound life and they try to help obese people.,37
938,May 27 2020 11:31 AM,"The American public sees people with obesity as lazy, unmotivated and gross",39
939,May 27 2020 11:31 AM,That they are lazy and eat junk all day long.,60
940,May 27 2020 11:31 AM,Bad,50
941,May 27 2020 11:31 AM,?,22
942,May 27 2020 11:31 AM,75 percent of America is overweight,38
943,May 27 2020 11:30 AM,Slight to significant bias against person based on visual clues.,26
944,May 27 2020 11:30 AM,No one care,37
945,May 27 2020 11:28 AM,depends on the situation and persons involved.,68
946,May 27 2020 11:28 AM,"They are lazy, they eat all the time and do not try to lose the weight. They have no willpower.",27
947,May 27 2020 11:27 AM,they are irresponsible,30
948,May 27 2020 11:27 AM,Most probably do not care. Some may think we have to get some self control and I agree. It’s about will power. This is not a disease. It may be psychiatric but it is not a disease in the true sense of the word. And I am considered obese. I’m 60 pound over weight.,58
949,May 27 2020 11:26 AM,They think they are gross or lazy,68
950,May 27 2020 11:24 AM,it's a problem,33
951,May 27 2020 11:22 AM,na,30
952,May 27 2020 11:18 AM,"Badly, less of them",35
953,May 27 2020 11:17 AM,They think it’s a willpower issue.,51
954,May 27 2020 11:16 AM,the government was more involved to problem,43
955,May 27 2020 11:16 AM,They are lazier than people who are fit,41
956,May 27 2020 11:16 AM,"That they have no self control, that they are lazy, that they are addicted to food, that they are not quality people",33
957,May 27 2020 11:16 AM,Its expected,43
958,May 27 2020 11:14 AM,People think less of them,75
959,May 27 2020 11:13 AM,Obsess ,66
960,May 27 2020 11:13 AM,No,39
961,May 27 2020 11:13 AM,"High risk, disease",73
962,May 27 2020 11:11 AM,our society is obsessed peoples weight,59
963,May 27 2020 11:11 AM,It is a choice,52
964,May 27 2020 11:10 AM,"stupid, lazy, unable to control your eating",25
965,May 27 2020 11:10 AM,Want to be healthier,41
966,May 27 2020 11:09 AM,they do not discriminate,25
967,May 27 2020 11:09 AM,people are quick to judge but it's strange because more Americans are more overweight than than in the past.,32
968,May 27 2020 11:09 AM,"It’s becoming more acceptable, cuz of the whole fat shaming, u can’t address it, cuz then you are considered to be fat shaming",67
969,May 27 2020 11:08 AM,The American public thinks people with obesity are unhealthy.,57
970,May 27 2020 11:07 AM,"They are hypocritically mocked, insulted, laughed at while at the same time unhealthily promoted, particularly women like Ashley Graham.  It IS unhealthy to be that large.  Shouldn't be celebrated.  Victoria's Secret models should NOT be fat, overweight.  Lifeguards should not be overweight, etc.",49
971,May 27 2020 11:05 AM,"they're very complacent. in recent years, there has been a large movement of body acceptance, and while I agree one should not be bullied for their appearance, there's a difference between someone trying to improve someone else's health (hc providers) and someone outright bullying",29
972,May 27 2020 11:05 AM,they think that it is easy to lose weight.,35
973,May 27 2020 11:05 AM,"I think the American public thinks of fat people as lazy, disgusting, dirty, have no work ethic work personal drive or discipline.",68
974,May 27 2020 11:03 AM,That the person does not care enough about their health to do something to change.,73
975,May 27 2020 11:03 AM,Poor eating and drinking habits and lack of exercise,63
976,May 27 2020 11:02 AM,"They are lazy, inept and/or socially awkward.",56
977,May 27 2020 11:02 AM,"People tend to assume they have unhealthy habits, a lot of obese people have health issues that don’t allow them to loose weight. They tend to judge them quickly and assume that they don’t feel comfortable in their own bodies",31
978,May 27 2020 11:01 AM,Very judge mental for the most part,31
979,May 27 2020 11:01 AM,They think obese people are lazy,74
980,May 27 2020 11:01 AM,"Negative impression... lazy, unhealthy, poor, etc... It’s very sad!",57
981,May 27 2020 11:01 AM,Negative,38
982,May 27 2020 11:01 AM,I’m gonna try a,59
983,May 27 2020 11:00 AM,Y it typically,29
984,May 27 2020 11:00 AM,That they are irresponsible and dirty,26
985,May 27 2020 11:00 AM,"I think that people think it is unhealthy, which it is. I’m all about body positivity, but you should not be unhealthy or have a life threatening weight.",25
986,May 27 2020 10:55 AM,Weight too much,43
987,May 27 2020 10:55 AM,The general public is understanding. The media are not understanding.,35
988,May 27 2020 10:54 AM,"I feel like no one wants to be obese, but people are trying to be accepting.",53
989,May 27 2020 10:53 AM,Unhealthy and unattractive,24
990,May 27 2020 10:49 AM,People with obesity have no self control.,33
991,May 27 2020 10:49 AM,"Lazy, unhealthy, unattractive",64
992,May 27 2020 10:48 AM,It is in their control -- people eat too much,63
993,May 27 2020 10:46 AM,People have no self-control.,72
994,May 27 2020 10:46 AM,I think most Americans have very little respect for obese people. Most believe that weight is totally controlled by the individual.,52
995,May 27 2020 10:44 AM,n,28
996,May 27 2020 10:44 AM,Unhealthy,39
997,May 27 2020 10:44 AM,They think down on them,46
998,May 27 2020 10:42 AM,That they have no impulse control and don’t care about themselves. But all they care about is eating food.,45
999,May 27 2020 10:42 AM,Pessimistic,71
1000,May 27 2020 10:41 AM,they often think that obesity is for lazy people,21
1001,May 27 2020 10:40 AM,They will have a lot of health problems,42
1002,May 27 2020 10:40 AM,They have no idea that there could be an underlying medical condition that causes their weight problem. They think overweight people just eat too much,30
1003,May 27 2020 10:38 AM,They are thought to be irresponsible about their weight.,18
1004,May 27 2020 10:35 AM,Obese people are blamed for their problem.,28
1005,May 27 2020 10:30 AM,It’s unhealthy and a choice of the over weight person to change. ,20
1006,May 27 2020 10:30 AM,"I think that they see obese people as lacking self-control, lazy or gluttons",59
1007,May 27 2020 10:29 AM,That they’re lazy or unhealthy,59
1008,May 27 2020 10:29 AM,I dont think overweight individuals are offered the same opportunities and judged by others.,23
1009,May 27 2020 10:28 AM,what is their problem?,45
1010,May 27 2020 10:28 AM,"Obesity creates a negative impression because because people believe it signifies a lack of self control/self control. While this may be true in some cases, in many cases other factors, beyone the control of the obese person, may be the cause. These include genetic factors, health conditions, poverty, inadequate dietary education.",32
1011,May 27 2020 10:27 AM,"unhealthy, lack of knowledge about eating habits and food choices, lazy, unmotivated",26
1012,May 27 2020 10:27 AM,They think they are unhealthy and not responsible people,23
1013,May 27 2020 10:26 AM,it's their fault.,56
1014,May 27 2020 10:26 AM,They are lazy and eat too much,47
1015,May 27 2020 10:26 AM,That it’s not a problem,61
1016,May 27 2020 10:23 AM,meh,37
1017,May 27 2020 10:23 AM,Yes,54
1018,May 27 2020 10:23 AM,"That an obese person is a slob, unhealthy, and unhappy.",64
1019,May 27 2020 10:23 AM,As a bad thing,43
1020,May 27 2020 10:21 AM,lack discipline,33
1021,May 27 2020 10:21 AM,They are lazy and unhealthy,47
1022,May 27 2020 10:18 AM,Yes,37
1023,May 27 2020 10:17 AM,There are many that don't care about people's feelings.,44
1024,May 27 2020 10:16 AM,They do not accept it but do try to offer solutions.,33
1025,May 27 2020 10:16 AM,People with obesity are lazy and undisciplined.,35
1026,May 27 2020 10:13 AM,Very negative,59
1027,May 27 2020 10:10 AM,execise,63
1028,May 27 2020 10:10 AM,They are gluttons.  They are lazy.  They have no pride.  They are stupid. They are unattractive.,47
1029,May 27 2020 10:09 AM,not sure,34
1030,May 27 2020 10:08 AM,they look down on people over weight,27
1031,May 27 2020 10:08 AM,It's not as biased as it used to be since such a large percentage of the population is over weight.,29
1032,May 27 2020 10:06 AM,the are slobs and have no conttol,26
1033,May 27 2020 10:05 AM,That it’s disgusting.,74
1034,May 27 2020 10:05 AM,"Need to get their weight under control for health reasons, leads to many other diseases.",22
1035,May 27 2020 10:05 AM,I just got home from,74
1036,May 27 2020 10:04 AM,disease,24
1037,May 27 2020 10:03 AM,Think over weight people don’t want to lose weight because they are lazy,25
1038,May 27 2020 10:03 AM,Negatively,65
1039,May 27 2020 10:03 AM,"As stated previously, most people see a lack of discipline or laziness.",41
1040,May 27 2020 10:01 AM,"personal choices enhance genetic predisposition.  while some people are truly victims of poor health, its hard to be sympathetic towards someone with a 6 McRib a day haibt.",25
1041,May 27 2020 10:00 AM,Most people believe you shouldn’t be obese as it is unhealthy,60
1042,May 27 2020 09:56 AM,That they can’t control themselves around food.,55
