Respondents,Response.Date,Responses,Age
578,May 27 2020 03:30 PM,Unhealthy,35
579,May 27 2020 03:30 PM,"That they aren’t as good as someone who is a normal, healthy weight.",20
580,May 27 2020 03:30 PM,Sadly I think there becoming ok with it,18
581,May 27 2020 03:28 PM,lazy,60
582,May 27 2020 03:28 PM,"Lazy, slow, lack of self control",54
583,May 27 2020 03:28 PM,I think it’s viewed as unhealthy,33
584,May 27 2020 03:26 PM,"I believe the American public as a whole is brainwashed into believing people with obesity are gross and at fault for their weight, and that only size 0, stick skinny women and ripped men are acceptable/""beautiful"". I think it's sort of an unspoken concept because people are influenced, consciously and unconsciously, but what they see in the media.",39
585,May 27 2020 03:26 PM,Bad,46
586,May 27 2020 03:24 PM,They need to lose weight.,54
587,May 27 2020 03:24 PM,"In general, that any health problem suffered by an overweight person is due to their weight (unless is like a gunshot wound or something).",51
588,May 27 2020 03:21 PM,that they cant control what they eat and it's their own fault,51
589,May 27 2020 03:21 PM,That it’s a disease.,57
590,May 27 2020 03:21 PM,People who are overweight are judged and made fun of,73
591,May 27 2020 03:21 PM,Not sure,70
592,May 27 2020 03:20 PM,they think overweight people are stupid and lazy,73
593,May 27 2020 03:20 PM,They’re lazy or have no self control,45
594,May 27 2020 03:20 PM,I don't know,32
595,May 27 2020 03:19 PM,That they are “sick” and “poor” because they cannot afford healthy foods/ didn’t learn healthy coping mechanisms for stress/ or have a bad relationship with eating.,60
596,May 27 2020 03:18 PM,Fat people are perceived as unhealthy and lazy. They are typically more prone to disease and other health complications that increase the strain on our inadequate health care system.,67
597,May 27 2020 03:17 PM,they think obese people are lazy,44
598,May 27 2020 03:17 PM,That they’re unhealthy,21
599,May 27 2020 03:17 PM,That they have a control issue and cannot stop themselves from eating.,24
600,May 27 2020 03:17 PM,Negatively. But I was really skinny as a kid and got teased just as much.,37
601,May 27 2020 03:17 PM,I think they need to chill on fast food,33
602,May 27 2020 03:17 PM,I think a lot of people realize it’s a problem. I hate how it’s seems like it’s not okay to even bring it up though when someone is obese. Obesity is very dangerous and can kill a person in an instant. Are we supposed to just let a person eat themselves to death? Just being overweight isn’t deadly but obesity definitely is.,56
603,May 27 2020 03:17 PM,Disgusting,63
604,May 27 2020 03:16 PM,they think they don't have anything to do that's why they gained weight,19
605,May 27 2020 03:16 PM,For some it it out of their control but for most it is extremely poor eating habits.,42
606,May 27 2020 03:16 PM,A problem,65
607,May 27 2020 03:15 PM,Refer to the answer for question #1.,66
608,May 27 2020 03:14 PM,concerned,49
609,May 27 2020 03:14 PM,"Not intelligent, that they eat poorly, they do not take good care of themselves, they over eat, they eat fast food, they come from a lower socioeconomic class in society.",22
610,May 27 2020 03:13 PM,they are quick to judge if you don't meet the perfect mold need to mindful that we aren't all the same,28
611,May 27 2020 03:13 PM,that we are fat lazy slobs,73
612,May 27 2020 03:12 PM,people are judge based on their weight,44
613,May 27 2020 03:12 PM,kfkfkfkfcnvmvkgkgoggk,63
614,May 27 2020 03:11 PM,idk,22
615,May 27 2020 03:11 PM,People think obesity is lack of self-management and underweight is serious emotional issues,39
616,May 27 2020 03:11 PM,I think it's actually becoming more the norm. ,56
617,May 27 2020 03:10 PM,they shame them,28
618,May 27 2020 03:09 PM,I feel that it control a lot of situations for people.,30
619,May 27 2020 03:08 PM,that they are lazy,35
620,May 27 2020 03:06 PM,"They think that we are stupid, can't control ourselves, are lazy, unmotivated,and ugly.",47
621,May 27 2020 03:06 PM,"I believe skinnier people have a much easier time. People are more apt to do things for them, they get hired before an obese person with the same qualifications. Obese people tend to be looked at negatively.",27
622,May 27 2020 03:05 PM,they should get  into a diet,23
623,May 27 2020 03:05 PM,that they need to make major lifestyle changes and that it is dangerous for them to be overweight.,63
624,May 27 2020 03:05 PM,They are unhealthy,44
625,May 27 2020 03:05 PM,Eating the wrong food,44
626,May 27 2020 03:04 PM,that in general Americans are overweight and there are a lot of health problems associated with it,60
627,May 27 2020 03:03 PM,"Unfortunately, so many people are obese, it is becoming the norm.  And the healthcare system has to pay for these fat slobs.  Maybe covid will get rid of them.",60
628,May 27 2020 03:03 PM,They look down on them and make them feel less than they are,54
629,May 27 2020 03:03 PM,They are cruel to the over weight people,71
630,May 27 2020 03:02 PM,yea,74
631,May 27 2020 03:02 PM,They judge them. Because they are heavier people think they can’t do the same as someone lighter. They sometimes don’t give a person a try. They look at them as a failure when they are not. They just need that help to lose the weight and stay in shape.,20
632,May 27 2020 03:01 PM,They are lazy,54
633,May 27 2020 03:01 PM,I think as a society we look down upon those who are perceived as obese. ,61
634,May 27 2020 03:01 PM,I dont really know,49
635,May 27 2020 03:00 PM,Sass,31
636,May 27 2020 02:59 PM,"Negative perceptions, some of it based on the massive cost of obesity such as diabetes and heart disease.",45
637,May 27 2020 02:59 PM,Most are offended ,25
638,May 27 2020 02:58 PM,Na,72
639,May 27 2020 02:54 PM,they think it's unhealthy,61
640,May 27 2020 02:54 PM,americans are obsessed.  either you are obese or you are terrified of being obese bc you see how they are treated,25
641,May 27 2020 02:54 PM,To much emphasis is put on weight,69
642,May 27 2020 02:54 PM,They think that obesity is disgusting and ugly,23
643,May 27 2020 02:54 PM,The American public thinks they should just eat less.,53
644,May 27 2020 02:54 PM,I think they don’t like it and make it a point to point it out,33
645,May 27 2020 02:53 PM,it can  Calls Diabetes and heart problems,67
646,May 27 2020 02:53 PM,They think we are  sloppy and undisciplined. They love to turn their noses up at us and think they are better than we are,30
647,May 27 2020 02:53 PM,They think they are lazy and can’t control themselves and not attractive,54
648,May 27 2020 02:52 PM,They make fun of them and think they are less intelligent and attractive. ,70
649,May 27 2020 02:51 PM,they are unhealthy and need medical or other professional help to improve health and life quality.,19
650,May 27 2020 02:51 PM,sad,38
651,May 27 2020 02:51 PM,Thin Americans think that those with obesity are lazy and disgusting. They think they eat large quantities of sweets and junk food ALL the time. ,18
652,May 27 2020 02:51 PM,Still a stigma against it,21
653,May 27 2020 02:51 PM,G,60
654,May 27 2020 02:51 PM,Dont believe it,55
655,May 27 2020 02:49 PM,They think they’re lazy and don’t try to take care of themselves. They also believe that it’s something that they can control but choose not to.,28
656,May 27 2020 02:49 PM,It’s laziness ,23
657,May 27 2020 02:48 PM,Not sure.,30
658,May 27 2020 02:47 PM,People think overweight people are stupid and lazy and have poor hygiene.,33
659,May 27 2020 02:46 PM,They are often criticized for being over weight,44
660,May 27 2020 02:46 PM,Negative attitude sometimes but we are becoming more body positive these days,51
661,May 27 2020 02:45 PM,People are looked down upon due to obesity,43
662,May 27 2020 02:45 PM,"Lazy, undisciplined",24
663,May 27 2020 02:44 PM,"public thinks that obese people are stupid or poor,",59
664,May 27 2020 02:44 PM,The public is not understanding,74
665,May 27 2020 02:43 PM,They need to lose weight,60
666,May 27 2020 02:43 PM,They get mocked,70
667,May 27 2020 02:43 PM,I don’t really know,66
668,May 27 2020 02:41 PM,"That they aren’t like normal people, their lazy...guavjinshvu bush’s jaha h haha  Mahabharata jk kxndisbaubwhdbix jsisbg is ugtvakussb hahahah SJSU’s SJSU a hahaha has Han an jsibsha",33
669,May 27 2020 02:41 PM,Snaksnsmamsmamsm,25
670,May 27 2020 02:41 PM,It’s bad it’s out of control,35
671,May 27 2020 02:41 PM,Ask,71
672,May 27 2020 02:39 PM,"They’re dirty, lazy, Poor decision makers, come from poverty",53
673,May 27 2020 02:38 PM,You can do y’all like you wanna,70
674,May 27 2020 02:38 PM,And,21
675,May 27 2020 02:36 PM,Bias,55
676,May 27 2020 02:35 PM,negative,74
677,May 27 2020 02:34 PM,Happy,30
678,May 27 2020 02:33 PM,they are definitely made fun of and stared at.,29
679,May 27 2020 02:33 PM,"lazy, no will power, weak",69
680,May 27 2020 02:33 PM,i think they see them as bad lazy or sloppy,48
681,May 27 2020 02:33 PM,Uncontrollable urge to eat,25
682,May 27 2020 02:32 PM,not tolerated,70
683,May 27 2020 02:32 PM,lazy,33
684,May 27 2020 02:32 PM,"That they are stupid, have no willpower, and are ugly.",42
685,May 27 2020 02:32 PM,None,49
686,May 27 2020 02:32 PM,No comment,43
687,May 27 2020 02:32 PM,"Americans are known for obesity, it’s like our culture. However, it’s a huge problem here.",63
688,May 27 2020 02:31 PM,that these people are lazy,37
689,May 27 2020 02:31 PM,They don’t think much.,39
690,May 27 2020 02:31 PM,It’s a bad illness.,25
691,May 27 2020 02:30 PM,"it's an epidemic, it's the new norm, it's the individual's fault for being overweight.",28
692,May 27 2020 02:28 PM,that they are lazy and dumb,74
693,May 27 2020 02:28 PM,people Think obesity is not good for general health.,34
694,May 27 2020 02:28 PM,Individuals control their diet,45
695,May 27 2020 02:27 PM,"Unhealthy, no self control, a drain on healthcare system ",64
696,May 27 2020 02:26 PM,"They are unhealthy, and subject to substantially increased medical issues, resulting in rising insurance rates for all.",50
697,May 27 2020 02:25 PM,No,39
698,May 27 2020 02:24 PM,they judge them and automatically assume they’re unhealthy. weight is not always something we can control,33
699,May 27 2020 02:24 PM,most don't care,18
700,May 27 2020 02:24 PM,Need to respect people still,41
701,May 27 2020 02:23 PM,Obesity is unhealthy,33
702,May 27 2020 02:23 PM,American is too lenient about obesity.,33
703,May 27 2020 02:22 PM,Frowned upon,73
704,May 27 2020 02:20 PM,Not healthy,58
705,May 27 2020 02:19 PM,they think they are lazy or gluttonous,73
706,May 27 2020 02:17 PM,that they have no self control,48
707,May 27 2020 02:16 PM,they aren’t fit or really fat,35
708,May 27 2020 02:16 PM,that they're disgusting and lazy,68
709,May 27 2020 02:16 PM,nuisance to public,65
710,May 27 2020 02:16 PM,They think that obese people are lazy and gross,69
711,May 27 2020 02:16 PM,I think for the most part it is frowned upon despite the majority being clinically obese.,44
712,May 27 2020 02:14 PM,"They judge, bully and harass them. They think they’re gross, offended by them.",64
713,May 27 2020 02:14 PM,People seem to think fat people are gross people who are made to be ridiculed.,26
714,May 27 2020 02:12 PM,personal choice,68
715,May 27 2020 02:12 PM,They are lazy,47
716,May 27 2020 02:12 PM,That they are lazy and don’t care.,22
717,May 27 2020 02:11 PM,they eat too much,72
718,May 27 2020 02:11 PM,gggggggggggggyyy,46
719,May 27 2020 02:10 PM,Na,19
720,May 27 2020 02:09 PM,these days most people are ok with it,18
721,May 27 2020 02:09 PM,There is a huge negative association with being overweight.,67
722,May 27 2020 02:09 PM,That they should lose weight.,61
723,May 27 2020 02:09 PM,"People think obese people are sick and gross for letting themselves get to that point, while it's not true.",56
724,May 27 2020 02:08 PM,we are despised and called weak. in spite of the fact that my mother CAUSED eating disorders starting when I could barely speak. and now I have no thyroid. weight loss is difficult.,74
725,May 27 2020 02:08 PM,they look down on overweight people,58
726,May 27 2020 02:08 PM,They think of the people as strange.,27
727,May 27 2020 02:08 PM,They eat too much and don't exercise enough. ,71
728,May 27 2020 02:08 PM,That they are lazy,60
729,May 27 2020 02:08 PM,That it’s not good for you but some people don’t care,63
730,May 27 2020 02:08 PM,Overweight and lazy,21
731,May 27 2020 02:08 PM,I believe our American society looks down on obese people. It’s very sad but true. Obese people are treated poorly and mocked because of their weight problem.,35
732,May 27 2020 02:05 PM,Typically looked down upon.,22
733,May 27 2020 02:05 PM,Theyre sick,34
734,May 27 2020 02:05 PM,I believe that they think really bad about them,31
735,May 27 2020 02:05 PM,Don’t know,28
736,May 27 2020 02:03 PM,Large ones get my swingle ,50
737,May 27 2020 02:03 PM,"In general, I believe most people believe obesity is caused by overeating, laziness, lack of control of diet, lack of exercise. ",42
738,May 27 2020 02:02 PM,people with obesity are discriminated against and made to feel bad,62
739,May 27 2020 02:02 PM,Extreme negative attitude.,48
740,May 27 2020 02:02 PM,Disgusted,30
741,May 27 2020 02:02 PM,Big problem,25
742,May 27 2020 02:01 PM,"the majority find the obese disgusting and wis they would not wear those yoga pants the are stretched to the breaking point
also sitting on a chair and seeing their fat hanging everywhere makes people sick.
when their adipose is hanging over their belt it causes real mental distress.
to top it off is a family adipose people eating at Golden Coral and hogging the ice cream station after destroying the hot bar  ",24
743,May 27 2020 02:01 PM,mixed,40
744,May 27 2020 02:01 PM,They dislike them,21
745,May 27 2020 02:00 PM,"some embrace it, but generally people think obesity is undesirable",69
746,May 27 2020 02:00 PM,I think the American public thinks that people with obesity can change if they just stop eating less or change if they want to and that is not the case. They have so much more going on in their life than that.,68
747,May 27 2020 01:56 PM,"You mean what american's think of people who happen to be obese? See my answer to #8, multiply by those who ""voted"" for the clown in the White House and you'll have your answer. ",71
748,May 27 2020 01:55 PM,I think people who are severely obese are looked down upon. I feel that people think they are lazy and care very little about themselves. ,68
749,May 27 2020 01:54 PM,We judge obesity as a personal failing,58
750,May 27 2020 01:53 PM,it concerns health,24
751,May 27 2020 01:52 PM,that they are unhealthy and in pain which is true being overweight puts pressure on your spine and bones it can cause them to snap,33
752,May 27 2020 01:51 PM,Lose weight to get healthy life,37
753,May 27 2020 01:50 PM,no comments,70
754,May 27 2020 01:50 PM,most seem disgusted,57
755,May 27 2020 01:50 PM,"Their intellect is tied to their weight. If overweight, they are a slob and undesirable. ",53
756,May 27 2020 01:50 PM,People are judged everyday if they are over weight you hear it everywhere you go. It’s sickening to hear people talk about other people based on being bigger then they think they should be.,34
757,May 27 2020 01:49 PM,more emotional stress,51
758,May 27 2020 01:46 PM,They think they’re lazy and unhealthy.,40
759,May 27 2020 01:46 PM,That it’s normal. More people are overweight in America than anything else so it’s pretty normal.,56
760,May 27 2020 01:44 PM,we're  all different shapes and sizes it's easy to judge let's support eacother  instead,72
761,May 27 2020 01:44 PM,Pretty generous about the obesity than other countries,49
762,May 27 2020 01:44 PM,Lazy people,62
763,May 27 2020 01:42 PM,They are treated with a different favorability and bias in media and advertising,21
764,May 27 2020 01:40 PM,They are lazy and no will power.,74
765,May 27 2020 01:40 PM,Obese people are lazy and do not care about their weight enough to try and control it.,74
766,May 27 2020 01:40 PM,Lazy,51
767,May 27 2020 01:40 PM,Hi,20
768,May 27 2020 01:39 PM,in many ways you are essentially a second class citizen.,40
769,May 27 2020 01:36 PM,Not good,66
770,May 27 2020 01:35 PM,they feel it means a person isn't healthy,29
771,May 27 2020 01:35 PM,not a gra,39
772,May 27 2020 01:34 PM,they think they eat only junk which is not true.,48
773,May 27 2020 01:34 PM,Negatively,62
774,May 27 2020 01:33 PM,We assume that they are lazy and do not know how to eat healthy. We treat them very poorly.,51
775,May 27 2020 01:33 PM,They make bad remarks about them. ,38
776,May 27 2020 01:33 PM,Not much since obesity seems to be normal now.,34
777,May 27 2020 01:32 PM,people are very hateful towards overweight people,75
778,May 27 2020 01:32 PM,Yes,23
779,May 27 2020 01:31 PM,No,36
780,May 27 2020 01:31 PM,Djjdjdjd,36
781,May 27 2020 01:29 PM,they are lazy,61
782,May 27 2020 01:29 PM,They are unhealthy and create their own weight and health situation.,60
783,May 27 2020 01:28 PM,that they are less intelligent,24
784,May 27 2020 01:27 PM,"In general people look to to skinny people more - they are the ""ideal'",26
785,May 27 2020 01:25 PM,the public looks down on those visibly overweight,37
786,May 27 2020 01:25 PM,No self respect and lazy,59
787,May 27 2020 01:22 PM,dont know,56
788,May 27 2020 01:21 PM,Thinks poorly of them,68
789,May 27 2020 01:20 PM,They judge people based on their weight ,69
790,May 27 2020 01:19 PM,sloppy less attractive productive,44
791,May 27 2020 01:19 PM,They are lower class people.,38
792,May 27 2020 01:19 PM,I dont think people really care about obesity in America.,57
793,May 27 2020 01:19 PM,Hot chollas,73
794,May 27 2020 01:16 PM,unsurr,55
795,May 27 2020 01:16 PM,We are looked down upon,28
796,May 27 2020 01:16 PM,That they are the issue,56
797,May 27 2020 01:13 PM,they are unhealthy and lazy,60
798,May 27 2020 01:13 PM,"WEIGHT BIAS, YOU SHOULD LOOK LIKE A MODEL OR THEY'RE AGAINST IT",42
799,May 27 2020 01:13 PM,I dont know,62
800,May 27 2020 01:09 PM,They think obesity is gross,75
801,May 27 2020 01:09 PM,Loosers,30
802,May 27 2020 01:09 PM,"Lazy, poor control",59
803,May 27 2020 01:08 PM,none,35
804,May 27 2020 01:08 PM,Judged negatively,37
805,May 27 2020 01:07 PM,They do it to themselves and can control it.,32
806,May 27 2020 01:05 PM,shames them,69
807,May 27 2020 01:03 PM,That’s it is a new normal in the U.S.,24
808,May 27 2020 01:03 PM,That they have no self-control when it comes to eating.,50
809,May 27 2020 01:03 PM,Feel that they are lazy or dumb,38
810,May 27 2020 01:02 PM,They think they’re lazy and unhealthy,33
811,May 27 2020 01:02 PM,They often make fun of them,48
812,May 27 2020 01:02 PM,They are made fun of,25
813,May 27 2020 01:02 PM,They are losers/lazy,66
814,May 27 2020 01:02 PM,Negative thoughts,68
815,May 27 2020 01:02 PM,Loathing,32
816,May 27 2020 01:02 PM,I can here a lot to,66
817,May 27 2020 01:01 PM,"looks down on them, they have no control",70
818,May 27 2020 12:59 PM,they think they are lazy and have no self control,33
819,May 27 2020 12:59 PM,I think America in general more relaxed about obesity than what we should be. It’s a huge issue that caused many issues for our society.,56
820,May 27 2020 12:58 PM,its not good,61
821,May 27 2020 12:58 PM,They are bias.,27
822,May 27 2020 12:58 PM,"Obese people are seen as ugly, lazy and gluttonous",61
823,May 27 2020 12:57 PM,People think fat people are inferior to them,41
824,May 27 2020 12:56 PM,lazy,64
825,May 27 2020 12:55 PM,some are very cruel,63
826,May 27 2020 12:55 PM,Like what I've been told just push yourself away from table.Just say no thank u.,55
827,May 27 2020 12:54 PM,"lazy, uneducated, ugly",51
828,May 27 2020 12:54 PM,That they don’t care and need help,31
829,May 27 2020 12:52 PM,looked down upon like something is wrong with you,57
830,May 27 2020 12:52 PM,They think it's disgusting,53
831,May 27 2020 12:52 PM,Gross and lazy,48
832,May 27 2020 12:51 PM,That we should be able to take care of it and it is okay to treat people like dirt,74
833,May 27 2020 12:51 PM,I think thin people look down on overweight people.,18
834,May 27 2020 12:49 PM,"Obesity is in fact unhealthy and should try to be corrected. That's not what Americans think, it's just a fact. What other people think does not matter.",34
835,May 27 2020 12:47 PM,"self-destructive, unattractive",34
836,May 27 2020 12:47 PM,That they are lazy.,24
837,May 27 2020 12:47 PM,"People think they are disgusting human beings, they automatically think “ How did they let themselves get that way “. They think those people are ugly just because they’re bigger.",31
838,May 27 2020 12:46 PM,Everything,46
839,May 27 2020 12:45 PM,"Lazy, unproductive, unattractive, less worthy, easy targets",39
840,May 27 2020 12:44 PM,I think some frown on obesity but also think it's their own responsibility healthy,56
841,May 27 2020 12:43 PM,The public opinion of obesity is that the people are just too weak to control their eating. But many in America today are over weight. ,55
842,May 27 2020 12:41 PM,"They are, in general, looked down upon.",40
843,May 27 2020 12:40 PM,people think its always a person's fault they are obese.  sometimes its medical conditions out of their control.,36
844,May 27 2020 12:39 PM,"We live in a society where I feel that obesity is an eye-sore to the general public. Though many people here in America suffer from obesity, in my opinion, the 'public eye' I refer to are primarily the media, the business/corporate world and other professional fields.",30
845,May 27 2020 12:39 PM,It’s not normal,18
846,May 27 2020 12:37 PM,They are lazy and unmotivated but that is a lens to view other obese people with - most often people whom are obese are just as guilty of weight bias it is just directed towards people who are different,56
847,May 27 2020 12:37 PM,"In general, disgusting, unattractive, not intelligent, undesirable, not sexy, and in some cases like airplanes, annoying.  Public media is tending to campaign against bias, especially as the nation becomes more and more obese.",21
848,May 27 2020 12:36 PM,"They think they are lazy, non attractive",56
849,May 27 2020 12:36 PM,That they are lazy and unhealthy,25
850,May 27 2020 12:35 PM,That they are lazy and unattractive.,33
851,May 27 2020 12:34 PM,They’re lazy,65
852,May 27 2020 12:34 PM,I think people that are overweight are looked at unfavorably. ,32
853,May 27 2020 12:33 PM,It's the norm.,70
854,May 27 2020 12:32 PM,They think that it’s bad,67
855,May 27 2020 12:32 PM,Not good usually,29
856,May 27 2020 12:32 PM,I think the public is extremely opinionated about it. They have something to say if you are skinny or larger,62
857,May 27 2020 12:32 PM,"I think Americans have come to accept obesity as the standard, even though much of the time it is laziness. There are many people who are obese from medical conditions, but the American standard of lazy obesity has created this healthcare stigma.",23
858,May 27 2020 12:31 PM,they don't make a big deal out of it they make it seem that they do care but they don't when they give pizzas and burgers for kids to eat at their schools...,59
859,May 27 2020 12:31 PM,"that they are lazy, lack self control and have low self esteem.",19
860,May 27 2020 12:31 PM,"Few make fun of people who are obese. But I also depends on the region. In East like New York, overweight is kind of common whereas in west like California over weight people are less common and are subject to humiliation.",69
861,May 27 2020 12:30 PM,They are lazy  and not responsible.,31
862,May 27 2020 12:27 PM,I think most of americans think of obese people as gross and weird and fat. There are few people who are accepting.,20
863,May 27 2020 12:26 PM,They try to sit as far away from obese people like it's contagious. Point make fun of obese people. ,75
864,May 27 2020 12:24 PM,"They think that they are lazy and never move, but always eat.",73
865,May 27 2020 12:24 PM,That they are lazy,61
866,May 27 2020 12:24 PM,I think that America is unaware of the obesity problem that it has,23
867,May 27 2020 12:24 PM,Fat people are lazy. They can do something about it but they just choose no to,63
868,May 27 2020 12:23 PM,"Lazy, unmotivated.",38
869,May 27 2020 12:22 PM,ok,53
870,May 27 2020 12:22 PM,The American public thinks people with obesity are lazy or have no self-control. ,71
871,May 27 2020 12:20 PM,"think they have low self esteem, lack of control, live unhealthy life style",62
872,May 27 2020 12:19 PM,"implies laziness, gluttony.",33
873,May 27 2020 12:19 PM,americans seem to accept more overweight and obesity as a norm,44
874,May 27 2020 12:18 PM,a higher and higher percentage of the population is now obese. it's more accepted in regular life but I think we still have unrealistic standards,65
875,May 27 2020 12:18 PM,"There are ways in which control over body weight is taken from certain people, and this correlates to specific neighborhoods and socioeconomic groups. However, weight isn’t a protected category in the same way as race, religion, or gender because it is something that everyone does have control over and can be changed through diet and exercise. This country has an obesity epidemic and people who are overweight can and should work to reduce their body weight",47
876,May 27 2020 12:17 PM,comfortable,35
877,May 27 2020 12:17 PM,They are looked down on.,28
878,May 27 2020 12:16 PM,they are lazy and lack self-control,50
879,May 27 2020 12:16 PM,"They are lazy, gluttonous, low self control",18
880,May 27 2020 12:16 PM,Obesity will be concerned and treated under their ability,65
